{
  "schema_version": "avila.core/signature/v0.1-draft",
  "signed_document": {
    "role": "manifest",
    "document_id": "CASE-001",
    "sha256": "sha256:754a5ae9de5e5e3008342e3b5b12746f6a770ef3a716bb483bc7e8fd5121363c"
  },
  "key_id": "191c470d8848ffedf3bb54e33798e98423a5659db297877d6482a06c96149cd7",
  "algorithm": "ed25519",
  "signature_hex": "6418403da078f8a7989398b9dad82ac11f3992e7b96d6d174bca0ef0f193d403f5b069dd5f06322e50041d4b24ea5a6a4742a4fac418bece80af9c654215320c",
  "notice": "A signature proves possession of a key at signing time. It does not establish the correctness of what was signed, qualification, review, or regulatory suitability."
}
